{
  "bundleVersion": "cm-preview-2.0-draft",
  "schemaVersion": "cm-content/2",
  "status": "DRAFT",
  "productionEnabled": false,
  "notice": "Editorial proposal derived from prototype topics. Not clinically approved. Do not deploy as production content.",
  "profiles": [
    {
      "id": "longevity",
      "title": "Heart health & prevention",
      "sourceLabel": "Longevity and prevention",
      "keys": [
        "satfat",
        "fiber",
        "sugar",
        "sodium"
      ],
      "labels": [
        "Saturated fat",
        "Fibre",
        "Free sugars",
        "Salt (sodium)"
      ],
      "lead": "Explore the food topics considered in heart-health nutrition support.",
      "topics": [
        "Food composition and everyday eating patterns",
        "Fibre sources and the types of fat in a meal",
        "How food preferences can shape an individual plan"
      ],
      "caution": "This preview is not a personal diet or a judgement of your meal.",
      "contentVersion": "2.0-draft",
      "clinicalStatus": "PENDING_APPROVAL",
      "productionEnabled": false,
      "mode": "CARE_PREVIEW",
      "diagnosisEffect": "NONE",
      "enrolmentEffect": "NONE",
      "analysisRuleEffect": "NONE",
      "source": "S02: FRX_RULES.longevity",
      "labelsStatus": "PROPOSED_EDITORIAL_ALIGNMENT",
      "benefitText": "Review the nutrition benefits included in available iLive Care plans. Individual support depends on the plan and clinical assessment.",
      "sections": [
        "PREVIEW_HEADER",
        "NUTRIENT_TOPICS",
        "TOPICS_TO_DISCUSS",
        "IMPORTANT_CONTEXT",
        "HOW_TARGETS_ARE_SET",
        "CARE_ACTION"
      ]
    },
    {
      "id": "diabetes",
      "title": "Diabetes",
      "sourceLabel": "Diabetes",
      "keys": [
        "carb",
        "sugar",
        "fiber",
        "protein"
      ],
      "labels": [
        "Carbohydrate",
        "Free sugars",
        "Fibre",
        "Protein"
      ],
      "lead": "Explore what nutrition support for diabetes can consider.",
      "topics": [
        "Carbohydrate amounts and meal patterns",
        "The role of fibre and protein in the meal",
        "How medicines, preferences and other conditions inform individual advice"
      ],
      "caution": "This preview does not predict your glucose response or advise a medicine change.",
      "contentVersion": "2.0-draft",
      "clinicalStatus": "PENDING_APPROVAL",
      "productionEnabled": false,
      "mode": "CARE_PREVIEW",
      "diagnosisEffect": "NONE",
      "enrolmentEffect": "NONE",
      "analysisRuleEffect": "NONE",
      "source": "S02: FRX_RULES.diabetes",
      "labelsStatus": "PROPOSED_EDITORIAL_ALIGNMENT",
      "benefitText": "Review the nutrition benefits included in available iLive Care plans. Individual support depends on the plan and clinical assessment.",
      "sections": [
        "PREVIEW_HEADER",
        "NUTRIENT_TOPICS",
        "TOPICS_TO_DISCUSS",
        "IMPORTANT_CONTEXT",
        "HOW_TARGETS_ARE_SET",
        "CARE_ACTION"
      ]
    },
    {
      "id": "hypertension",
      "title": "High blood pressure",
      "sourceLabel": "High blood pressure",
      "keys": [
        "sodium",
        "satfat",
        "potassium"
      ],
      "labels": [
        "Salt (sodium)",
        "Saturated fat",
        "Potassium"
      ],
      "lead": "Explore the food topics considered in blood-pressure care.",
      "topics": [
        "Salt sources in meals and packaged foods",
        "Food choices, preparation and overall eating pattern",
        "Other health conditions and medicines considered together"
      ],
      "caution": "Do not interpret a nutrient topic as an instruction to increase or restrict it.",
      "contentVersion": "2.0-draft",
      "clinicalStatus": "PENDING_APPROVAL",
      "productionEnabled": false,
      "mode": "CARE_PREVIEW",
      "diagnosisEffect": "NONE",
      "enrolmentEffect": "NONE",
      "analysisRuleEffect": "NONE",
      "source": "S02: FRX_RULES.hypertension",
      "labelsStatus": "PROPOSED_EDITORIAL_ALIGNMENT",
      "benefitText": "Review the nutrition benefits included in available iLive Care plans. Individual support depends on the plan and clinical assessment.",
      "sections": [
        "PREVIEW_HEADER",
        "NUTRIENT_TOPICS",
        "TOPICS_TO_DISCUSS",
        "IMPORTANT_CONTEXT",
        "HOW_TARGETS_ARE_SET",
        "CARE_ACTION"
      ]
    },
    {
      "id": "ckd",
      "title": "Kidney care · not on dialysis",
      "sourceLabel": "Kidney disease",
      "keys": [
        "potassium",
        "phosphorus",
        "sodium",
        "protein"
      ],
      "labels": [
        "Potassium",
        "Phosphate",
        "Salt (sodium)",
        "Protein"
      ],
      "lead": "See why kidney nutrition support needs individual review.",
      "topics": [
        "The kidney-care context and available clinical information",
        "Protein, mineral and salt topics considered together",
        "How an individual plan differs from a general food list"
      ],
      "caution": "No protein, mineral or fluid limit is prescribed in this preview. Follow your own care team’s advice.",
      "contentVersion": "2.0-draft",
      "clinicalStatus": "PENDING_APPROVAL",
      "productionEnabled": false,
      "mode": "CARE_PREVIEW",
      "diagnosisEffect": "NONE",
      "enrolmentEffect": "NONE",
      "analysisRuleEffect": "NONE",
      "source": "S02: FRX_RULES.ckd",
      "labelsStatus": "PROPOSED_EDITORIAL_ALIGNMENT",
      "benefitText": "Review the nutrition benefits included in available iLive Care plans. Individual support depends on the plan and clinical assessment.",
      "sections": [
        "PREVIEW_HEADER",
        "NUTRIENT_TOPICS",
        "TOPICS_TO_DISCUSS",
        "IMPORTANT_CONTEXT",
        "HOW_TARGETS_ARE_SET",
        "CARE_ACTION"
      ]
    },
    {
      "id": "ckdDialysis",
      "title": "Kidney care · dialysis",
      "sourceLabel": "Kidney disease on dialysis",
      "keys": [
        "potassium",
        "phosphorus",
        "protein",
        "sodium"
      ],
      "labels": [
        "Potassium",
        "Phosphate",
        "Protein",
        "Salt (sodium)"
      ],
      "lead": "Explore nutrition support in the context of dialysis care.",
      "topics": [
        "Dialysis context and the person’s nutritional needs",
        "Protein and mineral topics reviewed together",
        "Meal preferences and prescribed instructions considered in one plan"
      ],
      "caution": "This preview does not change medicines, binder timing, fluid limits or your prescribed diet.",
      "contentVersion": "2.0-draft",
      "clinicalStatus": "PENDING_APPROVAL",
      "productionEnabled": false,
      "mode": "CARE_PREVIEW",
      "diagnosisEffect": "NONE",
      "enrolmentEffect": "NONE",
      "analysisRuleEffect": "NONE",
      "source": "S02: FRX_RULES.ckdDialysis",
      "labelsStatus": "PROPOSED_EDITORIAL_ALIGNMENT",
      "benefitText": "Review the nutrition benefits included in available iLive Care plans. Individual support depends on the plan and clinical assessment.",
      "sections": [
        "PREVIEW_HEADER",
        "NUTRIENT_TOPICS",
        "TOPICS_TO_DISCUSS",
        "IMPORTANT_CONTEXT",
        "HOW_TARGETS_ARE_SET",
        "CARE_ACTION"
      ]
    },
    {
      "id": "recovery",
      "title": "Recovery after hospital care",
      "sourceLabel": "Recovery after surgery or hospital",
      "keys": [
        "protein",
        "kcal",
        "fiber"
      ],
      "labels": [
        "Protein",
        "Calories",
        "Fibre"
      ],
      "lead": "Explore the role of nutrition support during recovery.",
      "topics": [
        "Food intake, appetite and the recovery context",
        "Protein, energy and everyday meal choices",
        "Other conditions and discharge instructions considered together"
      ],
      "caution": "Recovery needs individual assessment. This is not a rehabilitation or post-surgery prescription.",
      "contentVersion": "2.0-draft",
      "clinicalStatus": "PENDING_APPROVAL",
      "productionEnabled": false,
      "mode": "CARE_PREVIEW",
      "diagnosisEffect": "NONE",
      "enrolmentEffect": "NONE",
      "analysisRuleEffect": "NONE",
      "source": "S02: FRX_RULES.recovery",
      "labelsStatus": "PROPOSED_EDITORIAL_ALIGNMENT",
      "benefitText": "Review the nutrition benefits included in available iLive Care plans. Individual support depends on the plan and clinical assessment.",
      "sections": [
        "PREVIEW_HEADER",
        "NUTRIENT_TOPICS",
        "TOPICS_TO_DISCUSS",
        "IMPORTANT_CONTEXT",
        "HOW_TARGETS_ARE_SET",
        "CARE_ACTION"
      ]
    }
  ]
}
